                                       
 _____            _____            _   
|   __| _ _  ___ |_   _| ___  ___ | |_ 
|__   || | ||   |  | |  | -_||_ -||  _|
|_____||_  ||_|_|  |_|  |___||___||_|  
       |___|                           

FID-1701652190789-eykH2BetGgG15Pet9dMRTd

 Module loaded: 

  - Module: @syntest/init (0.2.2-beta.6)
    - Tools: 
      - init: A tool for initializing SynTest projects.
    - Plugins: []
    - Presets: []
  - Module: crash (0.0.1)
    - Tools: 
      - crash: A tool for javascript crash reproduction.
    - Plugins: 
      - javascript-tree: A JavaScript tree crossover plugin
      - javascript-random: A JavaScript random sampler plugin
      - stackTrace: A stack trace based objective manager
      - SearchMetricListener: A listener that collects statistics about the search process.
      - SearchPerformanceListener: A listener that outputs the performance of the search algorithm.
      - SearchProgressBarListener: A listener that creates and updates a progress bar for the search process.
      - simple: A simple objective manager
      - structural: A structural objective manager
      - structural-uncovered: A structural uncovered objective manager
      - tracking: A tracking objective manager
      - uncovered: An uncovered objective manager
      - least-errors: Secondary objective based on wether the encoding introduces an error
      - smallest-encoding: Secondary objective based on the length of the test case
      - default: A default procreation operator
      - MOSAFamily: Many-Objective Sorting Algorithm
      - NSGAII: NSGAII search algorithm
      - random: Random search algorithm
      - signal: Terminates the search when a signal is received
    - Presets: 
      - DynaMOSA: DynaMOSA preset
      - MOSA: MOSA preset
      - NSGAII: NSGAII preset
      - random: Random preset

Loading Crashes... 
javascript-algorithms-28

up to date, audited 1 package in 127ms

found 0 vulnerabilities

javascript-algorithms-280

up to date, audited 1 package in 137ms

found 0 vulnerabilities

javascript-algorithms-281

up to date, audited 1 package in 136ms

found 0 vulnerabilities

javascript-algorithms-282

up to date, audited 1 package in 135ms

found 0 vulnerabilities

javascript-algorithms-283

up to date, audited 1 package in 129ms

found 0 vulnerabilities

javascript-algorithms-284

up to date, audited 1 package in 137ms

found 0 vulnerabilities

javascript-algorithms-285

up to date, audited 1 package in 138ms

found 0 vulnerabilities

javascript-algorithms-286

up to date, audited 1 package in 133ms

found 0 vulnerabilities

javascript-algorithms-287

up to date, audited 1 package in 138ms

found 0 vulnerabilities

javascript-algorithms-288

up to date, audited 1 package in 131ms

found 0 vulnerabilities

javascript-algorithms-289

up to date, audited 1 package in 137ms

found 0 vulnerabilities

javascript-algorithms-29

up to date, audited 1 package in 131ms

found 0 vulnerabilities

javascript-algorithms-290

up to date, audited 1 package in 136ms

found 0 vulnerabilities

javascript-algorithms-291

up to date, audited 1 package in 127ms

found 0 vulnerabilities

javascript-algorithms-292

up to date, audited 1 package in 137ms

found 0 vulnerabilities

javascript-algorithms-293

up to date, audited 1 package in 130ms

found 0 vulnerabilities

javascript-algorithms-294

up to date, audited 1 package in 137ms

found 0 vulnerabilities

javascript-algorithms-295

up to date, audited 1 package in 130ms

found 0 vulnerabilities

javascript-algorithms-296

up to date, audited 1 package in 137ms

found 0 vulnerabilities

javascript-algorithms-297

up to date, audited 1 package in 130ms

found 0 vulnerabilities

javascript-algorithms-3

up to date, audited 1 package in 135ms

found 0 vulnerabilities

javascript-algorithms-30

up to date, audited 1 package in 130ms

found 0 vulnerabilities

javascript-algorithms-31

up to date, audited 1 package in 138ms

found 0 vulnerabilities

javascript-algorithms-32

up to date, audited 1 package in 126ms

found 0 vulnerabilities

javascript-algorithms-33

up to date, audited 1 package in 138ms

found 0 vulnerabilities

javascript-algorithms-34

up to date, audited 1 package in 130ms

found 0 vulnerabilities

javascript-algorithms-35

up to date, audited 1 package in 138ms

found 0 vulnerabilities

javascript-algorithms-36

up to date, audited 1 package in 128ms

found 0 vulnerabilities

javascript-algorithms-37

up to date, audited 1 package in 136ms

found 0 vulnerabilities

javascript-algorithms-38

up to date, audited 1 package in 137ms

found 0 vulnerabilities

javascript-algorithms-39

up to date, audited 1 package in 137ms

found 0 vulnerabilities

javascript-algorithms-4

up to date, audited 1 package in 137ms

found 0 vulnerabilities

javascript-algorithms-40

up to date, audited 1 package in 135ms

found 0 vulnerabilities

javascript-algorithms-41

up to date, audited 1 package in 135ms

found 0 vulnerabilities

javascript-algorithms-42

up to date, audited 1 package in 138ms

found 0 vulnerabilities

javascript-algorithms-43

up to date, audited 1 package in 128ms

found 0 vulnerabilities

javascript-algorithms-44

up to date, audited 1 package in 134ms

found 0 vulnerabilities

javascript-algorithms-45

up to date, audited 1 package in 138ms

found 0 vulnerabilities

javascript-algorithms-46

up to date, audited 1 package in 134ms

found 0 vulnerabilities

javascript-algorithms-47

up to date, audited 1 package in 135ms

found 0 vulnerabilities

javascript-algorithms-48

up to date, audited 1 package in 134ms

found 0 vulnerabilities

javascript-algorithms-49

up to date, audited 1 package in 135ms

found 0 vulnerabilities

javascript-algorithms-5

up to date, audited 1 package in 128ms

found 0 vulnerabilities

javascript-algorithms-50

up to date, audited 1 package in 135ms

found 0 vulnerabilities

javascript-algorithms-51

up to date, audited 1 package in 137ms

found 0 vulnerabilities

javascript-algorithms-52

up to date, audited 1 package in 127ms

found 0 vulnerabilities

javascript-algorithms-53

up to date, audited 1 package in 140ms

found 0 vulnerabilities

javascript-algorithms-54

up to date, audited 1 package in 134ms

found 0 vulnerabilities

javascript-algorithms-55

up to date, audited 1 package in 127ms

found 0 vulnerabilities

javascript-algorithms-56

up to date, audited 1 package in 135ms

found 0 vulnerabilities

javascript-algorithms-57

up to date, audited 1 package in 134ms

found 0 vulnerabilities

javascript-algorithms-58

up to date, audited 1 package in 127ms

found 0 vulnerabilities

javascript-algorithms-59

up to date, audited 1 package in 135ms

found 0 vulnerabilities

javascript-algorithms-6

up to date, audited 1 package in 136ms

found 0 vulnerabilities

javascript-algorithms-60

up to date, audited 1 package in 128ms

found 0 vulnerabilities

javascript-algorithms-61

up to date, audited 1 package in 136ms

found 0 vulnerabilities

javascript-algorithms-62

up to date, audited 1 package in 136ms

found 0 vulnerabilities

javascript-algorithms-63

up to date, audited 1 package in 129ms

found 0 vulnerabilities

javascript-algorithms-64

up to date, audited 1 package in 135ms

found 0 vulnerabilities

javascript-algorithms-65

up to date, audited 1 package in 137ms

found 0 vulnerabilities


 GENERAL INFO 


 TARGETS 

  - /local/tmp/oliverphil/4255793.1/syntest-crash-reproduction/benchmark/crashes/syntest-collected/javascript-algorithms/javascript-algorithms-28/javascript-algorithms/src/algorithms/sorting/Sort.js: Sort.js #5
    - class /local/tmp/oliverphil/4255793.1/syntest-crash-reproduction/benchmark/crashes/syntest-collected/javascript-algorithms/javascript-algorithms-28/javascript-algorithms/src/algorithms/sorting/Sort.js:11:15:::34:1:::402:1067
    - method /local/tmp/oliverphil/4255793.1/syntest-crash-reproduction/benchmark/crashes/syntest-collected/javascript-algorithms/javascript-algorithms-28/javascript-algorithms/src/algorithms/sorting/Sort.js:12:2:::15:3:::417:590
    - method /local/tmp/oliverphil/4255793.1/syntest-crash-reproduction/benchmark/crashes/syntest-collected/javascript-algorithms/javascript-algorithms-28/javascript-algorithms/src/algorithms/sorting/Sort.js:21:2:::29:3:::686:993
    - function /local/tmp/oliverphil/4255793.1/syntest-crash-reproduction/benchmark/crashes/syntest-collected/javascript-algorithms/javascript-algorithms-28/javascript-algorithms/src/algorithms/sorting/Sort.js:23:10:::23:33:::792:815
    - method /local/tmp/oliverphil/4255793.1/syntest-crash-reproduction/benchmark/crashes/syntest-collected/javascript-algorithms/javascript-algorithms-28/javascript-algorithms/src/algorithms/sorting/Sort.js:31:2:::33:3:::997:1065
  - /local/tmp/oliverphil/4255793.1/syntest-crash-reproduction/benchmark/crashes/syntest-collected/javascript-algorithms/javascript-algorithms-28/javascript-algorithms/src/algorithms/sorting/radix-sort/RadixSort.js: RadixSort.js #15
    - class /local/tmp/oliverphil/4255793.1/syntest-crash-reproduction/benchmark/crashes/syntest-collected/javascript-algorithms/javascript-algorithms-28/javascript-algorithms/src/algorithms/sorting/radix-sort/RadixSort.js:8:15:::152:1:::232:4389
    - method /local/tmp/oliverphil/4255793.1/syntest-crash-reproduction/benchmark/crashes/syntest-collected/javascript-algorithms/javascript-algorithms-28/javascript-algorithms/src/algorithms/sorting/radix-sort/RadixSort.js:13:2:::32:3:::328:1054
    - function /local/tmp/oliverphil/4255793.1/syntest-crash-reproduction/benchmark/crashes/syntest-collected/javascript-algorithms/javascript-algorithms-28/javascript-algorithms/src/algorithms/sorting/radix-sort/RadixSort.js:26:35:::28:7:::957:1013
    - method /local/tmp/oliverphil/4255793.1/syntest-crash-reproduction/benchmark/crashes/syntest-collected/javascript-algorithms/javascript-algorithms-28/javascript-algorithms/src/algorithms/sorting/radix-sort/RadixSort.js:39:2:::61:3:::1140:2026
    - function /local/tmp/oliverphil/4255793.1/syntest-crash-reproduction/benchmark/crashes/syntest-collected/javascript-algorithms/javascript-algorithms-28/javascript-algorithms/src/algorithms/sorting/radix-sort/RadixSort.js:45:18:::58:5:::1429:1999
    - method /local/tmp/oliverphil/4255793.1/syntest-crash-reproduction/benchmark/crashes/syntest-collected/javascript-algorithms/javascript-algorithms-28/javascript-algorithms/src/algorithms/sorting/radix-sort/RadixSort.js:69:2:::79:3:::2143:2514
    - function /local/tmp/oliverphil/4255793.1/syntest-crash-reproduction/benchmark/crashes/syntest-collected/javascript-algorithms/javascript-algorithms-28/javascript-algorithms/src/algorithms/sorting/radix-sort/RadixSort.js:72:18:::76:5:::2286:2487
    - method /local/tmp/oliverphil/4255793.1/syntest-crash-reproduction/benchmark/crashes/syntest-collected/javascript-algorithms/javascript-algorithms-28/javascript-algorithms/src/algorithms/sorting/radix-sort/RadixSort.js:87:2:::100:3:::2639:3163
    - method /local/tmp/oliverphil/4255793.1/syntest-crash-reproduction/benchmark/crashes/syntest-collected/javascript-algorithms/javascript-algorithms-28/javascript-algorithms/src/algorithms/sorting/radix-sort/RadixSort.js:106:2:::108:3:::3359:3440
    - method /local/tmp/oliverphil/4255793.1/syntest-crash-reproduction/benchmark/crashes/syntest-collected/javascript-algorithms/javascript-algorithms-28/javascript-algorithms/src/algorithms/sorting/radix-sort/RadixSort.js:114:2:::122:3:::3502:3757
    - function /local/tmp/oliverphil/4255793.1/syntest-crash-reproduction/benchmark/crashes/syntest-collected/javascript-algorithms/javascript-algorithms-28/javascript-algorithms/src/algorithms/sorting/radix-sort/RadixSort.js:119:24:::121:5:::3669:3740
    - method /local/tmp/oliverphil/4255793.1/syntest-crash-reproduction/benchmark/crashes/syntest-collected/javascript-algorithms/javascript-algorithms-28/javascript-algorithms/src/algorithms/sorting/radix-sort/RadixSort.js:128:2:::131:3:::3820:3943
    - method /local/tmp/oliverphil/4255793.1/syntest-crash-reproduction/benchmark/crashes/syntest-collected/javascript-algorithms/javascript-algorithms-28/javascript-algorithms/src/algorithms/sorting/radix-sort/RadixSort.js:137:2:::143:3:::4010:4263
    - function /local/tmp/oliverphil/4255793.1/syntest-crash-reproduction/benchmark/crashes/syntest-collected/javascript-algorithms/javascript-algorithms-28/javascript-algorithms/src/algorithms/sorting/radix-sort/RadixSort.js:142:48:::142:56:::4249:4257
    - method /local/tmp/oliverphil/4255793.1/syntest-crash-reproduction/benchmark/crashes/syntest-collected/javascript-algorithms/javascript-algorithms-28/javascript-algorithms/src/algorithms/sorting/radix-sort/RadixSort.js:149:2:::151:3:::4326:4387

╔════════════════════════════════════════════════════════════════════════════════════════════════════════════════════════════════════════════════════════════════════════════════════════════════════════════════════════════════════════════════════════════════════════════════════════════════════════════════════════════════════════════════════════════════════════════════════════════════════════════════════════════════════════════════════════════════════════════════════════════════════════════════════════════════════════════════════════════════════════════════════════════════════════════════════════════════════════════════╗
║                                                                                                                                                                                                                                                                                                               SELECTION SETTINGS                                                                                                                                                                                                                                                                                                               ║
╟───────────────────────┬────────────────────────────────────────────────────────────────────────────────────────────────────────────────────────────────────────────────────────────────────────────────────────────────────────────────────────────────────────────────────────────────────────────────────────────────────────────────────────────────────────────────────────────────────────────────────────────────────────────────────────────────────────────────────────────────────────────────────────────────────────────────────────────────────────────────────────────────────────────────────────────────────────────────────────╢
║ Setting               │ Value                                                                                                                                                                                                                                                                                                                                                                                                                                                                                                                                                                                                                  ║
╟───────────────────────┼────────────────────────────────────────────────────────────────────────────────────────────────────────────────────────────────────────────────────────────────────────────────────────────────────────────────────────────────────────────────────────────────────────────────────────────────────────────────────────────────────────────────────────────────────────────────────────────────────────────────────────────────────────────────────────────────────────────────────────────────────────────────────────────────────────────────────────────────────────────────────────────────────────────────────────╢
║ Target Root Directory │ benchmark/crashes                                                                                                                                                                                                                                                                                                                                                                                                                                                                                                                                                                                                      ║
╟───────────────────────┼────────────────────────────────────────────────────────────────────────────────────────────────────────────────────────────────────────────────────────────────────────────────────────────────────────────────────────────────────────────────────────────────────────────────────────────────────────────────────────────────────────────────────────────────────────────────────────────────────────────────────────────────────────────────────────────────────────────────────────────────────────────────────────────────────────────────────────────────────────────────────────────────────────────────────────╢
║ Target Include        │ ./benchmark/crashes/syntest-collected/javascript-algorithms/javascript-algorithms-28/**/javascript-algorithms/src/algorithms/sorting/Sort.js, ./benchmark/crashes/syntest-collected/javascript-algorithms/javascript-algorithms-28/**/javascript-algorithms/src/algorithms/sorting/Sort.js, ./benchmark/crashes/syntest-collected/javascript-algorithms/javascript-algorithms-28/**/javascript-algorithms/src/algorithms/sorting/radix-sort/RadixSort.js, ./benchmark/crashes/syntest-collected/javascript-algorithms/javascript-algorithms-28/**/javascript-algorithms/src/algorithms/sorting/radix-sort/RadixSort.js ║
╟───────────────────────┼────────────────────────────────────────────────────────────────────────────────────────────────────────────────────────────────────────────────────────────────────────────────────────────────────────────────────────────────────────────────────────────────────────────────────────────────────────────────────────────────────────────────────────────────────────────────────────────────────────────────────────────────────────────────────────────────────────────────────────────────────────────────────────────────────────────────────────────────────────────────────────────────────────────────────────╢
║ Target Exclude        │                                                                                                                                                                                                                                                                                                                                                                                                                                                                                                                                                                                                                        ║
╟───────────────────────┼────────────────────────────────────────────────────────────────────────────────────────────────────────────────────────────────────────────────────────────────────────────────────────────────────────────────────────────────────────────────────────────────────────────────────────────────────────────────────────────────────────────────────────────────────────────────────────────────────────────────────────────────────────────────────────────────────────────────────────────────────────────────────────────────────────────────────────────────────────────────────────────────────────────────────────╢
║ Analysis Include      │                                                                                                                                                                                                                                                                                                                                                                                                                                                                                                                                                                                                                        ║
╟───────────────────────┼────────────────────────────────────────────────────────────────────────────────────────────────────────────────────────────────────────────────────────────────────────────────────────────────────────────────────────────────────────────────────────────────────────────────────────────────────────────────────────────────────────────────────────────────────────────────────────────────────────────────────────────────────────────────────────────────────────────────────────────────────────────────────────────────────────────────────────────────────────────────────────────────────────────────────────╢
║ Analysis Exclude      │ **/commander*/**/*.test.js, **/commander*/**/test/**/*.*, **/commander*/**/node_modules/**/*.*, **/*.spec.js                                                                                                                                                                                                                                                                                                                                                                                                                                                                                                           ║
╚═══════════════════════╧════════════════════════════════════════════════════════════════════════════════════════════════════════════════════════════════════════════════════════════════════════════════════════════════════════════════════════════════════════════════════════════════════════════════════════════════════════════════════════════════════════════════════════════════════════════════════════════════════════════════════════════════════════════════════════════════════════════════════════════════════════════════════════════════════════════════════════════════════════════════════════════════════════════════════════╝

╔═══════════════════════════════════════════════════════════════╗
║                           SETTINGS                            ║
╟───────────────────────────┬───────────────────────────────────╢
║ Setting                   │ Value                             ║
╟───────────────────────────┼───────────────────────────────────╢
║ Preset                    │ DynaMOSA                          ║
╟───────────────────────────┼───────────────────────────────────╢
║ Search Algorithm          │ MOSAFamily                        ║
╟───────────────────────────┼───────────────────────────────────╢
║ Population Size           │ 50                                ║
╟───────────────────────────┼───────────────────────────────────╢
║ Objective Manager         │ structural-uncovered              ║
╟───────────────────────────┼───────────────────────────────────╢
║ Secondary Objectives      │ [least-errors, smallest-encoding] ║
╟───────────────────────────┼───────────────────────────────────╢
║ Procreation Operator      │ default                           ║
╟───────────────────────────┼───────────────────────────────────╢
║ Crossover Operator        │ javascript-tree                   ║
╟───────────────────────────┼───────────────────────────────────╢
║ Sampling Operator         │ javascript-random                 ║
╟───────────────────────────┼───────────────────────────────────╢
║ Termination Triggers      │ [signal]                          ║
╟───────────────────────────┼───────────────────────────────────╢
║ Test Minimization Enabled │ false                             ║
╟───────────────────────────┼───────────────────────────────────╢
║ Seed                      │ 0.5493094677732961                ║
╚═══════════════════════════╧═══════════════════════════════════╝

╔═══════════════════════════════════════════════════╗
║                  BUDGET SETTINGS                  ║
╟────────────────────┬──────────────────────────────╢
║ Setting            │ Value                        ║
╟────────────────────┼──────────────────────────────╢
║ Iteration Budget   │ 20 iterations                ║
╟────────────────────┼──────────────────────────────╢
║ Evaluation Budget  │ 9007199254740991 evaluations ║
╟────────────────────┼──────────────────────────────╢
║ Search Time Budget │ 600 seconds                  ║
╟────────────────────┼──────────────────────────────╢
║ Total Time Budget  │ 600 seconds                  ║
╚════════════════════╧══════════════════════════════╝

╔═══════════════════════════════════════════╗
║             MUTATION SETTINGS             ║
╟───────────────────────────────────┬───────╢
║ Setting                           │ Value ║
╟───────────────────────────────────┼───────╢
║ Delta Mutation Probability        │ 0.8   ║
╟───────────────────────────────────┼───────╢
║ Crossover Probability             │ 0.7   ║
╟───────────────────────────────────┼───────╢
║ Multi-point Crossover Probability │ 0.5   ║
╟───────────────────────────────────┼───────╢
║ Max Depth                         │ 5     ║
╟───────────────────────────────────┼───────╢
║ Max Action Statements             │ 5     ║
╟───────────────────────────────────┼───────╢
║ Explore Illegal Values            │ true  ║
╟───────────────────────────────────┼───────╢
║ Use Constant Pool Values          │ true  ║
╟───────────────────────────────────┼───────╢
║ Use Constant Pool Probability     │ 0.5   ║
╟───────────────────────────────────┼───────╢
║ Use Type Pool Values              │ true  ║
╟───────────────────────────────────┼───────╢
║ Use Type Pool Probability         │ 0.5   ║
╟───────────────────────────────────┼───────╢
║ Use Statement Pool Values         │ true  ║
╟───────────────────────────────────┼───────╢
║ Use Statement Pool Probability    │ 0.8   ║
╚═══════════════════════════════════╧═══════╝

╔══════════════════════════════════════════════════╗
║                  Type SETTINGS                   ║
╟───────────────────────────────────┬──────────────╢
║ Setting                           │ Value        ║
╟───────────────────────────────────┼──────────────╢
║ Type Inference Mode               │ proportional ║
╟───────────────────────────────────┼──────────────╢
║ Incorporate Execution Information │ true         ║
╟───────────────────────────────────┼──────────────╢
║ Random Type Probability           │ 0.1          ║
╚═══════════════════════════════════╧══════════════╝

╔═══════════════════════════════════════════╗
║            DIRECTORY SETTINGS             ║
╟───────────────────────┬───────────────────╢
║ Setting               │ Value             ║
╟───────────────────────┼───────────────────╢
║ Syntest Directory     │ syntest           ║
╟───────────────────────┼───────────────────╢
║ Temporary Directory   │ .syntest          ║
╟───────────────────────┼───────────────────╢
║ Target Root Directory │ benchmark/crashes ║
╚═══════════════════════╧═══════════════════╝

Extracting types
Resolving Types
╔══════════════════╗
║ Objective Counts ║
╟──────────┬───────╢
║ Type     │ Count ║
╟──────────┼───────╢
║ branch   │ 0     ║
╟──────────┼───────╢
║ path     │ 4     ║
╟──────────┼───────╢
║ function │ 4     ║
╚══════════╧═══════╝

╔══════════════════╗
║ Objective Counts ║
╟──────────┬───────╢
║ Type     │ Count ║
╟──────────┼───────╢
║ branch   │ 14    ║
╟──────────┼───────╢
║ path     │ 21    ║
╟──────────┼───────╢
║ function │ 14    ║
╚══════════╧═══════╝


 Postprocessing started 

Splitting done took: 2.302, went from 15 to 66 test cases
De-Duplication done took: 0.022, went from 66 to 13 test cases
archive size 2
archive size 11
Run Final Suite
Decode
Store
Decode
Store
Decode
Store
Decode
Store
Decode
Store
Decode
Store
Decode
Store
Decode
Store
Decode
Store
Decode
Store
Decode
Store
Decode
Store
Decode
Store
Run Final Suite 2
Decode
Decode

 SEARCH RESULTS 

╔═══════════════════════════════════════════════════════════════════════════════════════════════════════════════════════════════════════════════════════════════════════════════════════════════════════════════════════════════════════════════════════════════════════════════════════════════════════════════════╗
║                                                                                                                                                     Coverage                                                                                                                                                      ║
╟────────────────────────────┬─────────────────────┬─────────┬──────────┬──────────────────────┬────────────────────────────────────────────────────────────────────────────────────────────────────────────────────────────────────────────────────────────────────────────────────────────────────────────────────╢
║ Target                     │ Statement           │ Branch  │ Function │ Objectives           │ File                                                                                                                                                                                                               ║
╟────────────────────────────┼─────────────────────┼─────────┼──────────┼──────────────────────┼────────────────────────────────────────────────────────────────────────────────────────────────────────────────────────────────────────────────────────────────────────────────────────────────────────────────────╢
║ Sort.js: Sort.js           │ 10 / 10             │ 0 / 0   │ 4 / 4    │ 3 / 7                │ /local/tmp/oliverphil/4255793.1/syntest-crash-reproduction/benchmark/crashes/syntest-collected/javascript-algorithms/javascript-algorithms-28/javascript-algorithms/src/algorithms/sorting/Sort.js                 ║
╟────────────────────────────┼─────────────────────┼─────────┼──────────┼──────────────────────┼────────────────────────────────────────────────────────────────────────────────────────────────────────────────────────────────────────────────────────────────────────────────────────────────────────────────────╢
║ RadixSort.js: RadixSort.js │ 61 / 68             │ 14 / 14 │ 14 / 14  │ 3 / 7                │ /local/tmp/oliverphil/4255793.1/syntest-crash-reproduction/benchmark/crashes/syntest-collected/javascript-algorithms/javascript-algorithms-28/javascript-algorithms/src/algorithms/sorting/radix-sort/RadixSort.js ║
╟────────────────────────────┼─────────────────────┼─────────┼──────────┼──────────────────────┼────────────────────────────────────────────────────────────────────────────────────────────────────────────────────────────────────────────────────────────────────────────────────────────────────────────────────╢
║ Average                    │ 91.02564102564102 % │ 100 %   │ 100 %    │ 42.857142857142854 % │                                                                                                                                                                                                                    ║
╚════════════════════════════╧═════════════════════╧═════════╧══════════╧══════════════════════╧════════════════════════════════════════════════════════════════════════════════════════════════════════════════════════════════════════════════════════════════════════════════════════════════════════════════════╝

Decode
Decode

 GENERAL INFO 

No targets were selected! Try changing the 'target-include' parameter
